{
  "_generated": {
    "by": "scripts/compile.mjs",
    "inputs": [
      "registry.yaml",
      "taxonomy/capabilities.yaml",
      "manifests/*.yaml"
    ],
    "warning": "Generated file. Do not edit by hand - run `node scripts/compile.mjs`."
  },
  "capabilities": {
    "agent-process-guidance": {
      "category": "agent-governance",
      "name": "Agent Process Guidance",
      "note": "Advisory only. See permission-enforcement.",
      "products": [
        "graphpowers",
        "project-charter"
      ]
    },
    "architecture-drift-detection": {
      "category": "codebase-intelligence",
      "name": "Architecture Drift Detection",
      "products": [
        "graphpowers"
      ]
    },
    "artifact-generation": {
      "category": "code-transformation",
      "name": "Artifact Generation",
      "products": [
        "code-comrades",
        "project-charter"
      ]
    },
    "batch-file-processing": {
      "category": "code-transformation",
      "name": "Batch File Processing",
      "products": [
        "code-comrades"
      ]
    },
    "cache-stable-output": {
      "category": "codebase-intelligence",
      "name": "Cache-stable Output",
      "products": [
        "repocode"
      ]
    },
    "call-budget-enforcement": {
      "category": "agent-runtime-safety",
      "name": "Call Budget Enforcement",
      "products": [
        "agent-loop-guard"
      ]
    },
    "capability-auditing": {
      "category": "agent-governance",
      "name": "Capability Auditing",
      "products": [
        "project-charter"
      ]
    },
    "ci-gate": {
      "category": "cross-cutting",
      "name": "CI Gate",
      "note": "Fail a pipeline on a computed threshold. Shared across several products.",
      "products": [
        "edge-compat-check",
        "project-charter",
        "registry-guard",
        "repocode"
      ]
    },
    "cms-admin-ui-extension": {
      "category": "content-modelling",
      "name": "CMS Admin UI Extension",
      "products": [
        "block-builder"
      ]
    },
    "code-annotation": {
      "category": "code-transformation",
      "name": "Code Annotation",
      "products": [
        "code-comrades"
      ]
    },
    "code-generation": {
      "category": "code-transformation",
      "name": "Code Generation",
      "note": "Genuinely shared: test stubs and docs in one product, Payload block config emitted from stored schemas in another.",
      "products": [
        "block-builder",
        "code-comrades"
      ]
    },
    "content-compression": {
      "category": "codebase-intelligence",
      "name": "Content Compression",
      "note": "Reducing a file's size while preserving its useful structure, in order to fit a budget. Distinct from dropping the file.",
      "products": [
        "repocode"
      ]
    },
    "context-selection": {
      "category": "codebase-intelligence",
      "name": "Context Selection",
      "note": "Choosing and ordering which parts of a repository are relevant to a task. Includes the ranking that drives the choice; ranking-explanation covers making that choice inspectable, which is a separate user-facing capability.",
      "products": [
        "graphpowers",
        "repocode"
      ]
    },
    "dependency-visualization": {
      "category": "package-development",
      "name": "Dependency Visualization",
      "products": [
        "package-pilot"
      ]
    },
    "file-discovery": {
      "category": "codebase-intelligence",
      "name": "File Discovery",
      "note": "Walking a tree while honouring ignore rules. Genuinely shared.",
      "products": [
        "code-comrades",
        "edge-compat-check",
        "repocode"
      ]
    },
    "git-scoping": {
      "category": "cross-cutting",
      "name": "Git Scoping",
      "products": [
        "code-comrades",
        "graphpowers",
        "repocode"
      ]
    },
    "graph-impact-analysis": {
      "category": "codebase-intelligence",
      "name": "Graph Impact Analysis",
      "note": "Computes blast radius and reachability over a pre-built external graph. Merging this with import-graph-analysis would erase a real product boundary between building a graph and reasoning over one.",
      "products": [
        "graphpowers"
      ]
    },
    "human-approval-gating": {
      "category": "agent-governance",
      "name": "Human Approval Gating",
      "products": [
        "project-charter"
      ]
    },
    "import-graph-analysis": {
      "category": "codebase-intelligence",
      "name": "Import Graph Analysis",
      "note": "Builds the dependency graph itself by parsing source. Deliberately not merged with graph-impact-analysis, which consumes a graph built elsewhere.",
      "products": [
        "repocode"
      ]
    },
    "lifecycle-script-inspection": {
      "category": "dependency-risk",
      "name": "Lifecycle Script Inspection",
      "note": "Shared subject, different source: registry metadata before install versus a local package.json before linking.",
      "products": [
        "package-pilot",
        "registry-guard"
      ]
    },
    "local-registry-hosting": {
      "category": "package-development",
      "name": "Local Registry Hosting",
      "products": [
        "package-pilot"
      ]
    },
    "loop-detection": {
      "category": "agent-runtime-safety",
      "name": "Loop Detection",
      "products": [
        "agent-loop-guard"
      ]
    },
    "multi-tenancy": {
      "category": "content-modelling",
      "name": "Multi-tenancy",
      "products": [
        "block-builder"
      ]
    },
    "package-linking": {
      "category": "package-development",
      "name": "Package Linking",
      "products": [
        "package-pilot"
      ]
    },
    "package-verification": {
      "category": "dependency-risk",
      "name": "Package Verification",
      "note": "Evaluates a package you have not installed, from registry metadata. Deliberately not merged with vulnerability-audit.",
      "products": [
        "registry-guard"
      ]
    },
    "permission-enforcement": {
      "category": "agent-governance",
      "name": "Permission Enforcement",
      "note": "Blocks a disallowed action. Deliberately not merged with agent-process-guidance, which only advises.",
      "products": [
        "project-charter"
      ]
    },
    "ranking-explanation": {
      "category": "codebase-intelligence",
      "name": "Ranking Explanation",
      "products": [
        "repocode"
      ]
    },
    "remote-repository-fetch": {
      "category": "codebase-intelligence",
      "name": "Remote Repository Fetch",
      "products": [
        "repocode"
      ]
    },
    "repository-fact-extraction": {
      "category": "codebase-intelligence",
      "name": "Repository Fact Extraction",
      "products": [
        "code-comrades"
      ]
    },
    "runtime-compatibility-checking": {
      "category": "dependency-risk",
      "name": "Runtime Compatibility Checking",
      "products": [
        "edge-compat-check"
      ]
    },
    "sandbox-creation": {
      "category": "package-development",
      "name": "Sandbox Creation",
      "products": [
        "package-pilot"
      ]
    },
    "schema-import-export": {
      "category": "content-modelling",
      "name": "Schema Import and Export",
      "products": [
        "block-builder"
      ]
    },
    "schema-persistence": {
      "category": "content-modelling",
      "name": "Schema Persistence",
      "note": "Storing content-structure definitions outside application code, so they change without a deployment.",
      "products": [
        "block-builder"
      ]
    },
    "schema-validation": {
      "category": "content-modelling",
      "name": "Schema Validation",
      "note": "Scoped to content schemas. Not the same as validating an ecosystem artifact or a knowledge graph; those are unrelated schemas and must not be merged onto this leaf.",
      "products": [
        "block-builder"
      ]
    },
    "schema-versioning": {
      "category": "content-modelling",
      "name": "Schema Versioning",
      "products": [
        "block-builder"
      ]
    },
    "secret-scanning": {
      "category": "cross-cutting",
      "name": "Secret Scanning",
      "products": [
        "repocode"
      ]
    },
    "semantic-search": {
      "category": "cross-cutting",
      "name": "Semantic Search",
      "products": [
        "repocode"
      ]
    },
    "token-budgeting": {
      "category": "codebase-intelligence",
      "name": "Token Budgeting",
      "products": [
        "graphpowers",
        "repocode"
      ]
    },
    "typosquat-detection": {
      "category": "dependency-risk",
      "name": "Typosquat Detection",
      "products": [
        "registry-guard"
      ]
    },
    "visual-schema-design": {
      "category": "content-modelling",
      "name": "Visual Schema Design",
      "products": [
        "block-builder"
      ]
    },
    "vulnerability-audit": {
      "category": "dependency-risk",
      "name": "Vulnerability Audit",
      "note": "Reports known advisories against an installed tree. See package-verification for the pre-install case.",
      "products": [
        "package-pilot"
      ]
    },
    "workflow-state-management": {
      "category": "agent-governance",
      "name": "Workflow State Management",
      "products": [
        "project-charter"
      ]
    }
  },
  "categories": {
    "agent-governance": {
      "capabilities": [
        "agent-process-guidance",
        "capability-auditing",
        "human-approval-gating",
        "permission-enforcement",
        "workflow-state-management"
      ],
      "description": "Shaping or constraining what an AI agent is allowed to do.",
      "name": "Agent Governance"
    },
    "agent-runtime-safety": {
      "capabilities": [
        "call-budget-enforcement",
        "loop-detection"
      ],
      "description": "Detecting and bounding agent behaviour at tool-call level.",